"eco_code","eco_name","Fine_biome","Code"
"PA0905","Saharan halophytics","Savanna and scrubland","SAV"
"PA0906","Tigris-Euphrates alluvial salt marsh","Savanna and scrubland","SAV"
"PA0907","Suiphun-Khanka meadows and forest meadows","Temperate grassland","TEG"
"PA0908","Yellow Sea saline meadow","Temperate grassland","TEG"
"PA1001","Altai alpine meadow and tundra","Tundra","TUN"
"PA1002","Central Tibetan Plateau alpine steppe","Tundra","TUN"
"PA1003","Eastern Himalayan alpine shrub and meadows","Tundra","TUN"
"PA1004","Ghorat-Hazarajat alpine meadow","Tundra","TUN"
"PA1005","Hindu Kush alpine meadow","Tundra","TUN"
"PA1006","Karakoram-West Tibetan Plateau alpine steppe","Tundra","TUN"
"PA1007","Khangai Mountains alpine meadow","Tundra","TUN"
"PA1008","Kopet Dag woodlands and forest steppe","Savanna and scrubland","SAV"
"PA1009","Kuh Rud and Eastern Iran montane woodlands","Desert","DES"
"PA1010","Mediterranean High Atlas juniper steppe","Tundra","TUN"
"PA1011","North Tibetan Plateau-Kunlun Mountains alpine desert","Tundra","TUN"
"PA1012","Northwestern Himalayan alpine shrub and meadows","Tundra","TUN"
"PA1013","Ordos Plateau steppe","Desert","DES"
"PA1014","Pamir alpine desert and tundra","Tundra","TUN"
"PA1015","Qilian Mountains subalpine meadows","Tundra","TUN"
"PA1016","Sayan Alpine meadows and tundra","Tundra","TUN"
"PA1017","Southeast Tibet shrublands and meadows","Tundra","TUN"
"PA1018","Sulaiman Range alpine meadows","Tundra","TUN"
"PA1019","Tian Shan montane steppe and meadows","Tundra","TUN"
"PA1020","Tibetan Plateau alpine shrublands and meadows","Tundra","TUN"
"PA1021","Western Himalayan alpine shrub and Meadows","Tundra","TUN"
"PA1022","Yarlung Tsangpo arid steppe","Tundra","TUN"
"PA1101","Arctic desert","Tundra","TUN"
"PA1102","Bering tundra","Tundra","TUN"
"PA1103","Cherskii-Kolyma mountain tundra","Tundra","TUN"
"PA1104","Chukchi Peninsula tundra","Tundra","TUN"
"PA1105","Kamchatka Mountain tundra and forest tundra","Tundra","TUN"
"PA1106","Kola Peninsula tundra","Tundra","TUN"
"PA1107","Northeast Siberian coastal tundra","Tundra","TUN"
"PA1108","Northwest Russian-Novaya Zemlya tundra","Tundra","TUN"
"PA1109","Novosibirsk Islands arctic desert","Tundra","TUN"
"PA1110","Scandinavian Montane Birch forest and grasslands","Coniferous forest","COF"
"PA1111","Taimyr-Central Siberian tundra","Tundra","TUN"
"PA1112","Trans-Baikal Bald Mountain tundra","Tundra","TUN"
"PA1113","Wrangel Island arctic desert","Tundra","TUN"
"PA1114","Yamal-Gydan tundra","Tundra","TUN"
"PA1201","Aegean and Western Turkey sclerophyllous and mixed forests","Mediterranean","MED"
"PA1202","Anatolian conifer and deciduous mixed forests","Mediterranean","MED"
"PA1203","Canary Islands dry woodlands and forests","Mediterranean","MED"
"PA1204","Corsican montane broadleaf and mixed forests","Mediterranean","MED"
"PA1205","Crete Mediterranean forests","Mediterranean","MED"
"PA1206","Cyprus Mediterranean forests","Mediterranean","MED"
"PA1207","Eastern Mediterranean conifer-sclerophyllous-broadleaf forests","Mediterranean","MED"
"PA1208","Iberian conifer forests","Coniferous forest","COF"
"PA1209","Iberian sclerophyllous and semi-deciduous forests","Mediterranean","MED"
"PA1210","Illyrian deciduous forests","Mediterranean","MED"
"PA1211","Italian sclerophyllous and semi-deciduous forests","Mediterranean","MED"
"PA1212","Mediterranean acacia-argania dry woodlands and succulent thickets","Mediterranean","MED"
"PA1213","Mediterranean dry woodlands and steppe","Mediterranean","MED"
"PA1214","Mediterranean woodlands and forests","Mediterranean","MED"
"PA1215","Northeastern Spain and Southern France Mediterranean forests","Mediterranean","MED"
"PA1216","Northwest Iberian montane forests","Coniferous forest","COF"
"PA1217","Pindus Mountains mixed forests","Mediterranean","MED"
"PA1218","South Appenine mixed montane forests","Mediterranean","MED"
"PA1219","Southeastern Iberian shrubs and woodlands","Mediterranean","MED"
"PA1220","Southern Anatolian montane conifer and deciduous forests","Coniferous forest","COF"
"PA1221","Southwest Iberian Mediterranean sclerophyllous and mixed forests","Mediterranean","MED"
"PA1222","Tyrrhenian-Adriatic Sclerophyllous and mixed forests","Mediterranean","MED"
"PA1301","Afghan Mountains semi-desert","Tundra","TUN"
"PA1302","Alashan Plateau semi-desert","Tundra","TUN"
"PA1303","Arabian Desert and East Sahero-Arabian xeric shrublands","Desert","DES"
"PA1304","Atlantic coastal desert","Desert","DES"
"PA1305","Azerbaijan shrub desert and steppe","Temperate grassland","TEG"
"PA1306","Badghyz and Karabil semi-desert","Desert","DES"
"PA1307","Baluchistan xeric woodlands","Savanna and scrubland","SAV"
"PA1308","Caspian lowland desert","Desert","DES"
"PA1309","Central Afghan Mountains xeric woodlands","Desert","DES"
"PA1310","Central Asian northern desert","Desert","DES"
"PA1311","Central Asian riparian woodlands","Temperate grassland","TEG"
"PA1312","Central Asian southern desert","Desert","DES"
"PA1313","Central Persian desert basins","Desert","DES"
"PA1314","Eastern Gobi desert steppe","Desert","DES"
"PA1315","Gobi Lakes Valley desert steppe","Desert","DES"
"PA1316","Great Lakes Basin desert steppe","Temperate grassland","TEG"
"PA1317","Junggar Basin semi-desert","Desert","DES"
"PA1318","Kazakh semi-desert","Desert","DES"
"PA1319","Kopet Dag semi-desert","Desert","DES"
"PA1320","Mesopotamian shrub desert","Desert","DES"
"PA1321","North Saharan steppe and woodlands","Desert","DES"
"PA1322","Paropamisus xeric woodlands","Desert","DES"
"PA1323","Persian Gulf desert and semi-desert","Desert","DES"
"PA1324","Qaidam Basin semi-desert","Desert","DES"
"PA1325","Red Sea Nubo-Sindian tropical desert and semi-desert","Desert","DES"
"PA1326","Registan-North Pakistan sandy desert","Desert","DES"
"PA1327","Sahara desert","Desert","DES"
"PA1328","South Iran Nubo-Sindian desert and semi-desert","Desert","DES"
"PA1329","South Saharan steppe and woodlands","Desert","DES"
"PA1330","Taklimakan desert","Desert","DES"
"PA1331","Tibesti-Jebel Uweinat montane xeric woodlands","Desert","DES"
"PA1332","West Saharan montane xeric woodlands","Desert","DES"
"PA1333","Red Sea coastal desert","Desert","DES"
"Rock and Ice","Rock and Ice","Tundra","TUN"
